{
  "mro_signoff_card_version": "0.1",
  "finding": {
    "id": "synthetic-borescope-finding-001",
    "kind": "borescope",
    "summary": "Synthetic imagery suggests a region for human inspection; no aircraft condition is asserted.",
    "model_id": "synthetic-inspection-assistant",
    "model_version": "0.1.0",
    "confidence": 0.71
  },
  "artifact": {
    "id": "synthetic-observation-001",
    "sha256": "48ec03319a4a3905c41b09cacd6c0e4fa0c1d94489786c475110ff8050aa0af6",
    "media_type": "application/json",
    "byte_length": 80
  },
  "evidence_refs": [
    "https://example.org/aviation/evidence/synthetic-observation-001.json"
  ],
  "human_review": {
    "staff_id": "synthetic-reviewer-01",
    "decision": "accept",
    "reviewed_at": "2026-10-12T14:00:00Z",
    "authority_ref": "https://example.org/aviation/authority/synthetic-reviewer-01",
    "comment": "Accepted the suggested region for further examination only."
  },
  "signature": {
    "profile": "JCS-SHA256-Ed25519-v1",
    "key_id": "synthetic-reviewer-key-01",
    "signed_at": "2026-10-12T14:01:00Z",
    "signature_b64url": "81zofgL7xfybjip3oIvtRnvfKtM3F8PKbnUHjedKsGMS4tP-vo-21Xf1ybVfpF3b3cOqtEBg3suK0vZ8wrUsAA"
  }
}
